{
  "schemaVersion": 1,
  "format": "embeddedknowledge-claims-v1",
  "lessonId": "PREM-QNT-003",
  "lessonVersion": "0.2.0",
  "claims": [
    {
      "id": "claim-ratio-quotient",
      "statement": "A ratio is an ordered comparison of two quantities by division, and multiplying both terms by the same nonzero factor preserves the quotient.",
      "sceneIds": [
        "scene-orientation",
        "scene-concept",
        "scene-worked-example",
        "scene-practice",
        "scene-transfer",
        "scene-synthesis",
        "scene-clinical-wrap-up"
      ],
      "sourceIds": [
        "source-nist-si-chapter8"
      ],
      "support": "synthesis",
      "confidence": "high",
      "scope": "Ordered ratios and equivalent ratios in introductory quantitative reasoning.",
      "uncertainty": "Whether two changing quantities are proportional requires a separate contextual assumption.",
      "risk": "routine",
      "reviewStatus": "reviewed"
    },
    {
      "id": "claim-proportion-equation",
      "statement": "A proportion is an equation asserting that two ratios are equal; a proposed solution can be verified by substitution.",
      "sceneIds": [
        "scene-concept",
        "scene-worked-example",
        "scene-practice",
        "scene-synthesis",
        "scene-clinical-wrap-up"
      ],
      "sourceIds": [
        "source-nist-si-chapter8"
      ],
      "support": "inference",
      "confidence": "high",
      "scope": "Equivalent-ratio equations with nonzero denominators.",
      "uncertainty": "An equation can be solved algebraically even when a real context does not justify proportional scaling.",
      "risk": "routine",
      "reviewStatus": "reviewed"
    },
    {
      "id": "claim-percentage-part-whole",
      "statement": "A percentage expresses a ratio per hundred, so a part-whole percentage must name the whole that represents 100 percent.",
      "sceneIds": [
        "scene-orientation",
        "scene-concept",
        "scene-practice",
        "scene-transfer",
        "scene-synthesis",
        "scene-clinical-wrap-up"
      ],
      "sourceIds": [
        "source-nist-si-chapter8"
      ],
      "support": "direct",
      "confidence": "high",
      "scope": "Introductory part-whole percentages and their fractional and decimal forms.",
      "uncertainty": "Percentages above 100 percent are possible when the numerator is not constrained to be a subset of the named whole.",
      "risk": "routine",
      "reviewStatus": "reviewed"
    },
    {
      "id": "claim-percent-change-reference",
      "statement": "Relative percent change compares the difference between new and old values with the old value.",
      "sceneIds": [
        "scene-orientation",
        "scene-concept",
        "scene-misconception",
        "scene-practice",
        "scene-transfer",
        "scene-synthesis",
        "scene-clinical-wrap-up"
      ],
      "sourceIds": [
        "source-moj-percentage-comparisons"
      ],
      "support": "direct",
      "confidence": "high",
      "scope": "Ordinary increase or decrease from a positive starting reference.",
      "uncertainty": "The reference and comparison direction must be named; the separate meaningful-zero boundary also applies.",
      "risk": "routine",
      "reviewStatus": "reviewed"
    },
    {
      "id": "claim-percentage-point-difference",
      "statement": "A percentage-point change is the arithmetic difference between two percentages and is distinct from relative percent change.",
      "sceneIds": [
        "scene-orientation",
        "scene-misconception",
        "scene-practice",
        "scene-transfer",
        "scene-synthesis",
        "scene-clinical-wrap-up"
      ],
      "sourceIds": [
        "source-moj-percentage-comparisons"
      ],
      "support": "direct",
      "confidence": "high",
      "scope": "Direct comparison of two values already expressed as percentages.",
      "uncertainty": "A point difference and a relative percentage answer different questions and must be labelled.",
      "risk": "routine",
      "reviewStatus": "reviewed"
    },
    {
      "id": "claim-relative-change-domain",
      "statement": "Ordinary percent increase or decrease is meaningful for a positive starting value on a ratio scale with a meaningful zero; zero, negative, and arbitrary-origin baselines require different handling.",
      "sceneIds": [
        "scene-concept",
        "scene-synthesis"
      ],
      "sourceIds": [
        "source-nist-metrics-measures",
        "source-moj-percentage-comparisons"
      ],
      "support": "synthesis",
      "confidence": "high",
      "scope": "Introductory ordinary percent change, not specialized signed, logarithmic, index, or domain-specific change measures.",
      "uncertainty": "A discipline may define another relative-change convention when its quantities or decisions require one.",
      "risk": "routine",
      "reviewStatus": "reviewed"
    }
  ]
}
