{
  "schemaVersion": 1,
  "format": "embeddedknowledge-claims-v1",
  "lessonId": "PSY-WEL-001",
  "lessonVersion": "0.1.1",
  "claims": [
    {
      "id": "claim-integrated-field-model",
      "statement": "This course studies psychiatry through mind, brain, person, relationship, culture, and system rather than reducing the field to a single scale.",
      "sceneIds": [
        "scene-welcome",
        "scene-six-lens-map",
        "scene-practice",
        "scene-transfer",
        "scene-synthesis"
      ],
      "sourceIds": [
        "source-psychiatry-syllabus",
        "source-wpa-training",
        "source-abpn-certification"
      ],
      "support": "synthesis",
      "confidence": "medium-high",
      "scope": "An EmbeddedKnowledge curricular framing informed by international training breadth and a current United States medical-specialty example; not a universal philosophical definition of psychiatry.",
      "uncertainty": "Professional and intellectual traditions weight these levels differently, and the model has not yet received lesson-level independent review.",
      "risk": "routine",
      "reviewStatus": "reviewed"
    },
    {
      "id": "claim-lenses-are-question-generators",
      "statement": "The lesson's six lenses generate distinct questions and do not imply that all six are causal, relevant, compatible, or equally weighted in every situation.",
      "sceneIds": [
        "scene-six-lens-map",
        "scene-practice",
        "scene-transfer",
        "scene-synthesis"
      ],
      "sourceIds": [
        "source-psychiatry-syllabus"
      ],
      "support": "inference",
      "confidence": "medium-high",
      "scope": "A declared use rule for the course's six-lens curricular model.",
      "uncertainty": "This model organizes questions; it does not validate a causal explanation or replace a discipline-specific method.",
      "risk": "routine",
      "reviewStatus": "reviewed"
    },
    {
      "id": "claim-training-breadth",
      "statement": "The World Psychiatric Association position statement approved in 2023 places culture, public mental health, research, service systems, lived-experience participation, and supervised development within postgraduate psychiatry training alongside clinical content.",
      "sceneIds": [
        "scene-welcome",
        "scene-six-lens-map"
      ],
      "sourceIds": [
        "source-wpa-training"
      ],
      "support": "direct",
      "confidence": "high",
      "scope": "The content of WPA Position Statement GA 23.10.3, approved in 2023; a professional position statement rather than an empirical estimate or universally binding curriculum.",
      "uncertainty": "The document header states a 2017 last-review date despite 2023 approval, and later replacement should be checked before publication updates.",
      "risk": "routine",
      "reviewStatus": "reviewed"
    },
    {
      "id": "claim-psychiatry-medical-specialty",
      "statement": "A United States board source places psychiatry within medicine and describes the specialty as connecting biological, psychological, and social domains.",
      "sceneIds": [
        "scene-welcome",
        "scene-six-lens-map",
        "scene-synthesis"
      ],
      "sourceIds": [
        "source-abpn-certification"
      ],
      "support": "direct",
      "confidence": "high",
      "scope": "The American Board of Psychiatry and Neurology's 2026 public certification page; used as a United States example, not a globally sufficient definition.",
      "uncertainty": "Other jurisdictions and psychiatric traditions may articulate the specialty's scope differently.",
      "risk": "routine",
      "reviewStatus": "reviewed"
    },
    {
      "id": "claim-authority-requires-governed-practice",
      "statement": "Academic reading, fictional-case reasoning, and simulation do not by themselves establish clinical authority; supervised patient care, competency decisions, and jurisdiction-specific authorization belong to separate governed routes.",
      "sceneIds": [
        "scene-welcome",
        "scene-boundary-worked",
        "scene-practice",
        "scene-transfer",
        "scene-synthesis"
      ],
      "sourceIds": [
        "source-psychiatry-syllabus",
        "source-wpa-training",
        "source-abpn-certification"
      ],
      "support": "synthesis",
      "confidence": "high",
      "scope": "The EmbeddedKnowledge course boundary, supported by a global postgraduate-training statement and a current United States certification example; it does not enumerate every jurisdiction's legal requirements.",
      "uncertainty": "The exact protected activities, titles, supervisory structures, and authorization requirements vary by jurisdiction.",
      "risk": "health-sensitive",
      "reviewStatus": "reviewed"
    },
    {
      "id": "claim-routes-vary-by-jurisdiction",
      "statement": "The WPA position statement reports cross-country variation in the level, duration, quality, and supervision of psychiatry training and requires local systems and regulations to shape curricula; ABPN documents one current United States certification and licensure route.",
      "sceneIds": [
        "scene-six-lens-map",
        "scene-boundary-worked"
      ],
      "sourceIds": [
        "source-wpa-training",
        "source-abpn-certification"
      ],
      "support": "synthesis",
      "confidence": "high",
      "scope": "Cross-country training variation described by WPA, with ABPN used only to instantiate one United States certification and licensure route.",
      "uncertainty": "No comparison of certification or legal authorization across multiple jurisdictions is claimed.",
      "risk": "routine",
      "reviewStatus": "reviewed"
    },
    {
      "id": "claim-personal-stories-require-governance",
      "statement": "Using a real person's private health story in openly published learning material requires an explicit consent, privacy, and rights process; describing the use as educational is not sufficient by itself.",
      "sceneIds": [
        "scene-practice"
      ],
      "sourceIds": [
        "source-psychiatry-syllabus"
      ],
      "support": "direct",
      "confidence": "high",
      "scope": "The EmbeddedKnowledge case and lived-experience contribution standard for open CC BY 4.0 course material; not a complete statement of privacy or consent law in any jurisdiction.",
      "uncertainty": "A future purpose-commissioned contribution would also require review under the then-current repository and local legal requirements.",
      "risk": "health-sensitive",
      "reviewStatus": "reviewed"
    }
  ]
}
