{"schemaVersion":1,"format":"embeddedknowledge-claims-v1","lessonId":"PREM-QNT-006","lessonVersion":"0.1.0","claims":[
{"id":"claim-log-inverse","statement":"For a positive base other than one, the real logarithm is the inverse of exponentiation on positive arguments: log base b of x equals y exactly when b to the y equals x.","sceneIds":["scene-orientation","scene-concept","scene-worked-example","scene-misconception","scene-practice","scene-transfer","scene-synthesis"],"sourceIds":["source-nist-dlmf-log"],"support":"direct","confidence":"high","scope":"Single-valued real logarithms with b > 0, b ≠ 1, and x > 0.","uncertainty":"Complex logarithms and branch choices are outside scope.","risk":"routine","reviewStatus":"pending-review"},
{"id":"claim-log-laws","statement":"The logarithm product, quotient, and power laws follow from the corresponding exponent laws when every logarithm argument lies in the real positive domain.","sceneIds":["scene-concept","scene-worked-example","scene-misconception","scene-practice","scene-transfer","scene-synthesis"],"sourceIds":["source-nist-dlmf-log"],"support":"inference","confidence":"high","scope":"Real logarithms of positive products, quotients, and powers used in this lesson.","uncertainty":"There is no analogous general rule that splits a logarithm across addition.","risk":"routine","reviewStatus":"pending-review"},
{"id":"claim-log-ratio","statement":"In quantitative applications, a logarithm is taken of a dimensionless number such as a ratio of like quantities rather than a bare dimensional quantity.","sceneIds":["scene-orientation","scene-concept","scene-worked-example","scene-practice","scene-transfer","scene-synthesis"],"sourceIds":["source-nist-si-log"],"support":"direct","confidence":"high","scope":"The growth, decay, and threshold ratios constructed in the lesson.","uncertainty":"Named logarithmic units and discipline-specific reference levels are outside scope.","risk":"routine","reviewStatus":"pending-review"},
{"id":"claim-exponential-parameterizations","statement":"For a positive initial value and a fixed time unit, an exponential model with per-unit factor a grows when a > 1 and decays when 0 < a < 1; the equivalent continuous-rate form uses k = ln a, or a = e^k.","sceneIds":["scene-orientation","scene-concept","scene-worked-example","scene-practice","scene-transfer","scene-synthesis"],"sourceIds":["source-nist-dlmf-log"],"support":"inference","confidence":"high","scope":"Positive real exponential models Q(t) = Q0 a^t and Q(t) = Q0 e^(kt) using the same time unit.","uncertainty":"Whether an empirical process actually follows an exact exponential model must be established separately.","risk":"routine","reviewStatus":"pending-review"},
{"id":"claim-half-life-relation","statement":"In an exact exponential decay model A(t) = A0(1/2)^(t/h), h > 0 is the time for A/A0 to reach one half; in the equivalent form A(t) = A0 e^(kt) with k < 0, h = -ln 2/k.","sceneIds":["scene-transfer","scene-synthesis"],"sourceIds":["source-nist-dlmf-log"],"support":"inference","confidence":"high","scope":"Exact positive exponential decay models with a fixed time unit.","uncertainty":"A fitted half-life has model and measurement uncertainty not represented by the fictional exact-model tasks in this lesson.","risk":"routine","reviewStatus":"pending-review"}]}
