{
  "schemaVersion": 1,
  "format": "embeddedknowledge-claims-v1",
  "lessonId": "PSY-INT-004",
  "lessonVersion": "0.1.0",
  "claims": [
    {
      "id": "claim-mse-describes-observation-period",
      "statement": "A mental-status examination sets out how a person appeared, spoke, moved, and responded during the evaluation itself, so it reports a defined period of observation while the history carries the longer course.",
      "sceneIds": [
        "scene-two-notes",
        "scene-writing-the-lines",
        "scene-second-reader",
        "scene-clinical-wrap-up"
      ],
      "sourceIds": [
        "source-statpearls-mse"
      ],
      "support": "direct",
      "confidence": "high",
      "scope": "The conventional purpose and scope of the examination as set out in a current clinical reference chapter; the sectioning, headings, and required detail vary between services and record systems.",
      "uncertainty": "The reference chapter describes established practice and does not report evidence on how well any particular way of writing the examination performs.",
      "risk": "routine",
      "reviewStatus": "reviewed"
    },
    {
      "id": "claim-mood-is-reported-affect-is-observed",
      "statement": "In psychiatric description, mood is the person's own account of their sustained emotional state and is recorded in their words where they have supplied them, while affect is the examiner's reading of the emotional expression shown during the encounter.",
      "sceneIds": [
        "scene-mood-and-affect",
        "scene-writing-the-lines",
        "scene-second-reader"
      ],
      "sourceIds": [
        "source-statpearls-mse",
        "source-barzilay-affect-rating"
      ],
      "support": "direct",
      "confidence": "high",
      "scope": "A descriptive convention of psychiatric assessment, stated in a current clinical reference chapter and restated in the introduction of a pilot study of affect rating.",
      "uncertainty": "The convention is standard in teaching and is applied inconsistently in practice; the same pilot study reports that clinicians hold differing conceptions of the two terms.",
      "risk": "routine",
      "reviewStatus": "reviewed"
    },
    {
      "id": "claim-affect-descriptors",
      "statement": "Affect is conventionally described by qualities including its range, which runs through terms such as flat, blunted, restricted, full, and broad, by the intensity of a change when it comes, and by whether it is congruent with the mood the person reports.",
      "sceneIds": [
        "scene-mood-and-affect",
        "scene-writing-the-lines",
        "scene-shorthand"
      ],
      "sourceIds": [
        "source-statpearls-mse"
      ],
      "support": "direct",
      "confidence": "medium-high",
      "scope": "The descriptive vocabulary listed in a current clinical reference chapter on the mental-status examination. That chapter names range terms, illustrates intensity by contrasting minimally irritated with extremely agitated, and defines congruent and incongruent against the reported mood. It does not name reactivity as a separate dimension, so this lesson presents reactivity as an observation to record rather than as part of the conventional descriptor set, and says so where it appears.",
      "uncertainty": "The vocabulary is not standardised across services or textbooks, and individual terms such as blunted and restricted are used with overlapping meanings.",
      "risk": "routine",
      "reviewStatus": "reviewed"
    },
    {
      "id": "claim-affect-ratings-vary-between-clinicians",
      "statement": "When five senior psychiatrists rated affect from the same recorded interviews of seven to ten minutes with 25 inpatients, mean agreement between raters was 54% for the quality of the affect, 43% for its range, and 25% for a finer subtype.",
      "sceneIds": [
        "scene-mood-and-affect",
        "scene-shorthand"
      ],
      "sourceIds": [
        "source-barzilay-affect-rating"
      ],
      "support": "direct",
      "confidence": "medium",
      "scope": "One pilot study at a single hospital with five raters, 25 male inpatients with schizophrenia, and brief recorded interviews; the figures describe that setting only.",
      "uncertainty": "The authors name the small sample, the single site, the restriction to male inpatients with schizophrenia, the absence of standardised symptom scales, and the short interviews as limits, and expect different performance where affect varies more. The figures are evidence that these judgements vary and are not an estimate of agreement in psychiatry generally.",
      "risk": "routine",
      "reviewStatus": "reviewed"
    },
    {
      "id": "claim-record-language-changes-later-clinicians",
      "statement": "In a randomised study of medical students and residents reading one of two chart notes about the same hypothetical patient, readers of the stigmatising note rated the patient less favourably on an attitude scale, and residents reading it chose less intensive pain management.",
      "sceneIds": [
        "scene-shorthand",
        "scene-second-reader"
      ],
      "sourceIds": [
        "source-goddu-record-language"
      ],
      "support": "direct",
      "confidence": "high",
      "scope": "One randomised vignette study of trainees at a single urban academic medical centre, using one clinical condition and a hypothetical patient.",
      "uncertainty": "The article carries a published correction that could not be retrieved through permitted routes, so no point estimate is asserted. One centre, hypothetical vignette, single clinical scenario.",
      "risk": "health-sensitive",
      "reviewStatus": "reviewed"
    },
    {
      "id": "claim-negative-attitude-categories-in-notes",
      "statement": "A qualitative study of 600 outpatient encounter notes written by 138 physicians identified five recurring ways negative attitude appeared in the record: questioning the patient's credibility, expressing disapproval of their reasoning or self-care, stereotyping through quoted speech, portraying the patient as difficult, and emphasising the physician's authority over the patient.",
      "sceneIds": [
        "scene-shorthand",
        "scene-practice"
      ],
      "sourceIds": [
        "source-park-record-attitudes"
      ],
      "support": "direct",
      "confidence": "high",
      "scope": "Notes from one ambulatory internal-medicine setting at a single urban academic centre in 2017, analysed qualitatively.",
      "uncertainty": "The study describes the forms found in that sample and does not estimate how common each form is in other settings or in psychiatric records.",
      "risk": "routine",
      "reviewStatus": "reviewed"
    },
    {
      "id": "claim-stigmatizing-terms-prevalence-and-disparity",
      "statement": "Across 48,651 hospital admission notes written at one urban academic medical centre in 2018, 2.5% contained at least one term from lists of stigmatising descriptors, and after adjustment the share was 0.67 percentage points higher in notes about Black patients than in notes about White patients, with a 95% confidence interval from 0.15 to 1.18.",
      "sceneIds": [
        "scene-shorthand"
      ],
      "sourceIds": [
        "source-himmelstein-stigmatizing-terms"
      ],
      "support": "direct",
      "confidence": "high",
      "scope": "A cross-sectional count of admission notes at one centre in a single year, using condition-specific lists of descriptors.",
      "uncertainty": "The measure detects only the descriptors on the lists used, so it undercounts stigmatising writing phrased in other ways, and a count of words does not establish the writer's intent or the consequence for any patient. The setting was general hospital medicine and not psychiatry.",
      "risk": "health-sensitive",
      "reviewStatus": "reviewed"
    },
    {
      "id": "claim-hypothyroid-symptom-overlap",
      "statement": "Fatigue, trouble tolerating cold, and depression are among the common symptoms of hypothyroidism listed by the United States National Institute of Diabetes and Digestive and Kidney Diseases.",
      "sceneIds": [
        "scene-clinical-wrap-up"
      ],
      "sourceIds": [
        "source-niddk-hypothyroidism"
      ],
      "support": "direct",
      "confidence": "high",
      "scope": "A public health-information page from a United States national institute, last reviewed in March 2021, describing common symptoms of an underactive thyroid in general terms.",
      "uncertainty": "A symptom list establishes that these complaints are recognised features of the condition and establishes nothing about how often any one of them indicates it in a given person. The lesson uses the fact only to show why such observations must stay visible in a record, and applies it to no one.",
      "risk": "health-sensitive",
      "reviewStatus": "reviewed"
    }
  ]
}
