{
  "schemaVersion": 1,
  "format": "embeddedknowledge-claims-v1",
  "lessonId": "PREM-QNT-007",
  "lessonVersion": "0.2.0",
  "claims": [
    {
      "id": "claim-function-notation",
      "statement": "Function notation associates each allowed input with one output, and composition evaluates one function's output as another function's input where both domains permit it.",
      "sceneIds": [
        "scene-orientation",
        "scene-concept",
        "scene-worked-example",
        "scene-misconception",
        "scene-practice",
        "scene-transfer",
        "scene-synthesis",
        "scene-clinical-wrap-up"
      ],
      "sourceIds": [
        "source-common-core-functions"
      ],
      "support": "direct",
      "confidence": "high",
      "scope": "Real-valued functions and compositions used in introductory quantitative reasoning.",
      "uncertainty": "Multivalued complex relations and advanced function spaces are outside scope.",
      "risk": "routine",
      "reviewStatus": "pending-review"
    },
    {
      "id": "claim-axis-quantity",
      "statement": "Graph axes and table headings should identify the represented quantity or numerical value and its unit unambiguously so coordinates and rates can be interpreted correctly.",
      "sceneIds": [
        "scene-orientation",
        "scene-concept",
        "scene-practice",
        "scene-synthesis",
        "scene-clinical-wrap-up"
      ],
      "sourceIds": [
        "source-nist-si-axis"
      ],
      "support": "direct",
      "confidence": "high",
      "scope": "Quantitative graphs and tables used in this lesson.",
      "uncertainty": "Clear labeling does not by itself make a selected visualization or model valid.",
      "risk": "routine",
      "reviewStatus": "pending-review"
    },
    {
      "id": "claim-transform-inference",
      "statement": "Translations, reflections, and stretches of a function can be derived by tracking how changed inputs reach parent inputs and how changed outputs are subsequently transformed.",
      "sceneIds": [
        "scene-concept",
        "scene-worked-example",
        "scene-misconception",
        "scene-practice",
        "scene-transfer",
        "scene-synthesis"
      ],
      "sourceIds": [
        "source-common-core-functions"
      ],
      "support": "inference",
      "confidence": "high",
      "scope": "Algebraic transformations of the real functions used in the lesson.",
      "uncertainty": "Graph appearance can also depend on the viewing window, which does not alter the underlying function.",
      "risk": "routine",
      "reviewStatus": "pending-review"
    },
    {
      "id": "claim-average-rate",
      "statement": "For distinct inputs a and b, average rate of change is the output change f(b)-f(a) divided by the input change b-a and is interpreted in output units per input unit over that interval.",
      "sceneIds": [
        "scene-orientation",
        "scene-concept",
        "scene-worked-example",
        "scene-practice",
        "scene-transfer",
        "scene-synthesis",
        "scene-clinical-wrap-up"
      ],
      "sourceIds": [
        "source-common-core-functions"
      ],
      "support": "direct",
      "confidence": "high",
      "scope": "Average rate of change for real-valued functions over intervals with distinct endpoints.",
      "uncertainty": "This interval average does not assert a constant or instantaneous rate within the interval.",
      "risk": "routine",
      "reviewStatus": "pending-review"
    }
  ]
}
