{
  "schemaVersion": 1,
  "format": "embeddedknowledge-claims-v1",
  "lessonId": "PREM-CHE-001",
  "lessonVersion": "0.0.0",
  "claims": [
    {
      "id": "claim-bronsted-model",
      "statement": "In the Brønsted–Lowry model, an acid donates a proton and a base accepts a proton.",
      "sceneIds": ["scene-concept", "scene-deep-reading", "scene-worked-example", "scene-practice", "scene-retrieval", "scene-synthesis"],
      "sourceIds": ["source-openstax-chemistry", "source-iupac-gold-book"],
      "support": "direct",
      "confidence": "high",
      "scope": "Introductory aqueous and molecular acid-base classification.",
      "uncertainty": null,
      "risk": "routine",
      "reviewStatus": "pending-review"
    },
    {
      "id": "claim-lewis-model",
      "statement": "In the Lewis model, a base donates an electron pair and an acid accepts an electron pair.",
      "sceneIds": ["scene-concept", "scene-deep-reading", "scene-practice", "scene-retrieval", "scene-synthesis"],
      "sourceIds": ["source-openstax-chemistry", "source-iupac-gold-book"],
      "support": "direct",
      "confidence": "high",
      "scope": "Introductory electron-pair acid-base classification.",
      "uncertainty": "The simple donor-acceptor model does not by itself quantify reaction extent or strength.",
      "risk": "routine",
      "reviewStatus": "pending-review"
    },
    {
      "id": "claim-buffer-response",
      "statement": "A conjugate base component can consume a small added amount of proton, limiting the resulting pH change until buffer capacity is approached.",
      "sceneIds": ["scene-transfer"],
      "sourceIds": ["source-openstax-chemistry"],
      "support": "synthesis",
      "confidence": "high",
      "scope": "Simplified equilibrium model for a weak-acid/conjugate-base buffer.",
      "uncertainty": "The statement does not specify biological compartments, activity corrections, or patient interpretation.",
      "risk": "health-sensitive",
      "reviewStatus": "pending-review"
    }
  ]
}
