{
  "schemaVersion": 1,
  "format": "embeddedknowledge-claims-v1",
  "lessonId": "PREM-SCI-006",
  "lessonVersion": "0.2.0",
  "claims": [
    {
      "id": "claim-operational-definition",
      "statement": "An operational definition makes a target inspectable by specifying the observable procedure or rule that produces its record, but an explicit operation does not by itself establish low error or valid construct meaning.",
      "sceneIds": [
        "scene-when-numbers-agree",
        "scene-four-question-audit",
        "scene-worked-alertness-audit",
        "scene-practise-and-repair",
        "scene-transfer-team-coordination",
        "scene-defend-judgment"
      ],
      "sourceIds": [
        "source-nist-operational-definition",
        "source-testing-standards"
      ],
      "support": "synthesis",
      "confidence": "high",
      "scope": "General introductory scientific measurement; the exact procedural detail needed depends on the target, field, population, and intended use.",
      "uncertainty": "Operational-definition terminology varies somewhat across disciplines; this lesson uses the shared function of linking a concept or quantity to observable operations.",
      "risk": "routine",
      "reviewStatus": "reviewed"
    },
    {
      "id": "claim-error-components",
      "statement": "Measurement error can contain a random component that varies unpredictably across replicate measurements and a systematic component that remains constant or varies predictably; repeated and reference data can reveal different patterns without making either component perfectly known.",
      "sceneIds": [
        "scene-four-question-audit",
        "scene-worked-alertness-audit",
        "scene-practise-and-repair",
        "scene-transfer-team-coordination",
        "scene-defend-judgment"
      ],
      "sourceIds": [
        "source-jcgm-vim",
        "source-nist-tn1297"
      ],
      "support": "direct",
      "confidence": "high",
      "scope": "Measurement results compared under stated replicate conditions and, when available, with an appropriate reference quantity value.",
      "uncertainty": "The true value and the sizes and causes of error components are generally not known perfectly; observed scatter or shift is evidence for a model, not proof of a unique cause.",
      "risk": "routine",
      "reviewStatus": "reviewed"
    },
    {
      "id": "claim-averaging-boundary",
      "statement": "Averaging repeated observations can reduce the influence of suitable centered random variation when independence and other assumptions are adequate, but averaging does not remove a stable systematic offset.",
      "sceneIds": [
        "scene-four-question-audit",
        "scene-worked-alertness-audit",
        "scene-practise-and-repair",
        "scene-transfer-team-coordination",
        "scene-defend-judgment"
      ],
      "sourceIds": [
        "source-jcgm-vim",
        "source-nist-tn1297"
      ],
      "support": "synthesis",
      "confidence": "high",
      "scope": "Repeated quantitative measurements for which the averaging target, error structure, dependence, stability, and reference conditions are defensible.",
      "uncertainty": "Averaging may fail or mislead when errors are dependent, drifting, non-centered, selection-dependent, or attached to explanatory variables in more complex models.",
      "risk": "routine",
      "reviewStatus": "reviewed"
    },
    {
      "id": "claim-repeatability-reproducibility",
      "statement": "Repeatability is precision under specified conditions with minimal planned change, whereas reproducibility is precision under specified changed conditions; both require the relevant conditions to be named and neither alone establishes accuracy or construct validity.",
      "sceneIds": [
        "scene-four-question-audit",
        "scene-worked-alertness-audit",
        "scene-practise-and-repair",
        "scene-transfer-team-coordination",
        "scene-defend-judgment"
      ],
      "sourceIds": [
        "source-jcgm-vim",
        "source-testing-standards"
      ],
      "support": "synthesis",
      "confidence": "high",
      "scope": "Measurement precision, including instrument and observer-coded results, under an explicitly described domain of replicate conditions.",
      "uncertainty": "Fields use reliability and reproducibility terminology differently; this lesson states the metrology meaning whenever it uses measurement repeatability or reproducibility.",
      "risk": "routine",
      "reviewStatus": "reviewed"
    },
    {
      "id": "claim-calibration-traceability",
      "statement": "Calibration establishes a relation between indications and standard-provided values under specified conditions, while metrological traceability relates a result to a reference through a documented unbroken calibration chain; neither property alone guarantees fitness for purpose or absence of mistakes.",
      "sceneIds": [
        "scene-four-question-audit",
        "scene-worked-alertness-audit",
        "scene-practise-and-repair",
        "scene-transfer-team-coordination",
        "scene-defend-judgment"
      ],
      "sourceIds": [
        "source-jcgm-vim",
        "source-nist-tn1297"
      ],
      "support": "direct",
      "confidence": "high",
      "scope": "Metrological measurement results and standards under documented calibration conditions and uncertainty contributions.",
      "uncertainty": "This lesson does not teach construction of calibration hierarchies, uncertainty budgets, or field-specific acceptance limits.",
      "risk": "routine",
      "reviewStatus": "reviewed"
    },
    {
      "id": "claim-validity-interpretation",
      "statement": "Validity is an evidence-based judgment about whether theory and accumulated evidence support a proposed interpretation for a stated use, population, and setting, rather than a timeless property attached to an instrument alone.",
      "sceneIds": [
        "scene-when-numbers-agree",
        "scene-four-question-audit",
        "scene-worked-alertness-audit",
        "scene-practise-and-repair",
        "scene-transfer-team-coordination",
        "scene-defend-judgment"
      ],
      "sourceIds": [
        "source-testing-standards"
      ],
      "support": "direct",
      "confidence": "high",
      "scope": "Interpretations and uses of scores or measurement results, especially for constructed attributes and observer- or test-based measures.",
      "uncertainty": "Some disciplines use validity more loosely for closeness to an intended target; the lesson makes the interpretation-and-use sense explicit when discussing construct validity.",
      "risk": "routine",
      "reviewStatus": "reviewed"
    },
    {
      "id": "claim-construct-evidence",
      "statement": "Construct-validity evidence can address content coverage, response processes, internal structure, predicted relations with similar or different constructs, relevant criteria, and whether irrelevant features or omitted content change meaning across populations and settings.",
      "sceneIds": [
        "scene-four-question-audit",
        "scene-worked-alertness-audit",
        "scene-practise-and-repair",
        "scene-transfer-team-coordination",
        "scene-defend-judgment"
      ],
      "sourceIds": [
        "source-testing-standards"
      ],
      "support": "direct",
      "confidence": "high",
      "scope": "Evidence selected because it bears on the specific construct interpretation and proposed use; not every source of evidence is required in every setting.",
      "uncertainty": "No single convergent, discriminant, content, or criterion result is an automatic certificate; evidential sufficiency depends on relevance, quality, stakes, and credible rival explanations.",
      "risk": "routine",
      "reviewStatus": "reviewed"
    },
    {
      "id": "claim-consistency-not-sufficient",
      "statement": "Consistency is necessary for many stable interpretations but is not sufficient for accuracy or construct validity, because results can agree while sharing a systematic shift or consistently representing the wrong or an incomplete attribute.",
      "sceneIds": [
        "scene-when-numbers-agree",
        "scene-four-question-audit",
        "scene-worked-alertness-audit",
        "scene-practise-and-repair",
        "scene-transfer-team-coordination",
        "scene-defend-judgment"
      ],
      "sourceIds": [
        "source-jcgm-vim",
        "source-testing-standards"
      ],
      "support": "synthesis",
      "confidence": "high",
      "scope": "Stable quantities or constructs when an interpretation presumes consistency across a stated domain of replications.",
      "uncertainty": "For constructs expected to change over time, disagreement may reflect real change rather than error; the replication domain must match the intended interpretation.",
      "risk": "routine",
      "reviewStatus": "reviewed"
    }
  ]
}
