{
  "schemaVersion": 1,
  "format": "embeddedknowledge-claims-v1",
  "lessonId": "PREM-LPP-003",
  "lessonVersion": "0.1.0",
  "claims": [
    {
      "id": "claim-mastery-performance",
      "statement": "For this lesson's operational model, a mastery judgment should rely on observable unaided performance after delay and variation rather than on familiarity during exposure or one immediate success.",
      "sceneIds": [
        "scene-orientation",
        "scene-concept",
        "scene-worked-example",
        "scene-retrieval-check",
        "scene-misconception",
        "scene-practice",
        "scene-transfer",
        "scene-assessment",
        "scene-synthesis"
      ],
      "sourceIds": [
        "source-authoring-evidence",
        "source-content-standard"
      ],
      "support": "synthesis",
      "confidence": "medium-high",
      "scope": "Operational planning model for foundation-level academic self-study and lesson sequencing, not a universal psychometric definition or professional competence standard.",
      "uncertainty": "No single task, score, delay, or number of successful attempts establishes mastery across all learners, domains, and retention goals.",
      "risk": "routine",
      "reviewStatus": "pending-review"
    },
    {
      "id": "claim-retrieval-durability",
      "statement": "Across the educational research summarized by the repository, practice that requires retrieval can support more durable later retention than repeated exposure, although effects depend on task, feedback, and test conditions.",
      "sceneIds": [
        "scene-orientation",
        "scene-concept",
        "scene-worked-example",
        "scene-retrieval-check",
        "scene-misconception",
        "scene-practice",
        "scene-transfer",
        "scene-assessment",
        "scene-synthesis"
      ],
      "sourceIds": [
        "source-authoring-evidence",
        "source-content-standard"
      ],
      "support": "synthesis",
      "confidence": "high",
      "scope": "Academic learning tasks represented in the cited rapid synthesis and the project design standard.",
      "uncertainty": "Retrieval formats, learner knowledge, feedback, stakes, delays, and final assessments vary; the claim does not guarantee an effect for every task or learner.",
      "risk": "routine",
      "reviewStatus": "pending-review"
    },
    {
      "id": "claim-spacing-retention-horizon",
      "statement": "Spreading retrieval across time generally benefits later retention, while a useful gap depends partly on how long the learner needs to retain and use the knowledge; the evidence does not yield one universal schedule.",
      "sceneIds": [
        "scene-concept",
        "scene-worked-example",
        "scene-practice",
        "scene-transfer",
        "scene-assessment",
        "scene-synthesis"
      ],
      "sourceIds": [
        "source-authoring-evidence",
        "source-content-standard"
      ],
      "support": "synthesis",
      "confidence": "high",
      "scope": "Planning academic retrieval across multiple opportunities and a stated retention horizon.",
      "uncertainty": "The best gap varies with retention interval, material, prior knowledge, retrievability, and the outcome being assessed.",
      "risk": "routine",
      "reviewStatus": "pending-review"
    },
    {
      "id": "claim-feedback-recovery",
      "statement": "After a genuine retrieval attempt, feedback is most useful for this design loop when it identifies correctness, explains the relevant principle or error, and directs a specific recovery action.",
      "sceneIds": [
        "scene-concept",
        "scene-worked-example",
        "scene-retrieval-check",
        "scene-misconception",
        "scene-practice",
        "scene-transfer",
        "scene-assessment"
      ],
      "sourceIds": [
        "source-authoring-evidence",
        "source-content-standard"
      ],
      "support": "synthesis",
      "confidence": "high",
      "scope": "Formative feedback in the academic retrieval-and-recovery cycle taught in this lesson.",
      "uncertainty": "Feedback interventions are heterogeneous; timing and detail should match the task and learner rather than follow one fixed script.",
      "risk": "routine",
      "reviewStatus": "pending-review"
    },
    {
      "id": "claim-interleaving-conditional",
      "statement": "Interleaving is a conditional design choice that is especially relevant when learners must discriminate among confusable, already introduced categories or strategies, rather than a universal replacement for supported initial acquisition.",
      "sceneIds": [
        "scene-concept",
        "scene-practice",
        "scene-transfer",
        "scene-assessment",
        "scene-synthesis"
      ],
      "sourceIds": [
        "source-authoring-evidence",
        "source-content-standard"
      ],
      "support": "synthesis",
      "confidence": "medium-high",
      "scope": "Selection and discrimination practice after learners have a usable initial representation of each category or strategy.",
      "uncertainty": "Average interleaving effects vary by material similarity, task type, learner preparation, and comparison condition.",
      "risk": "routine",
      "reviewStatus": "pending-review"
    },
    {
      "id": "claim-guidance-fading",
      "statement": "Novices generally benefit from a complete worked model before support is faded through completion, supported, independent, mixed-selection, and transfer tasks.",
      "sceneIds": [
        "scene-worked-example",
        "scene-practice",
        "scene-assessment"
      ],
      "sourceIds": [
        "source-authoring-evidence",
        "source-content-standard"
      ],
      "support": "synthesis",
      "confidence": "high",
      "scope": "Foundation-level learners acquiring the planning procedure in this lesson.",
      "uncertainty": "More knowledgeable learners may need less assistance, and support should respond to demonstrated performance.",
      "risk": "routine",
      "reviewStatus": "pending-review"
    }
  ]
}
