{
  "schemaVersion": 1,
  "format": "embeddedknowledge-claims-v1",
  "lessonId": "PREM-QNT-009",
  "lessonVersion": "0.2.0",
  "claims": [
    {
      "id": "claim-scalar-vector",
      "statement": "Within this lesson's real Cartesian setting, a scalar is one real numerical value, whereas a vector is represented by an ordered component tuple and follows vector addition and scalar multiplication; the zero vector is valid but has no unique direction.",
      "sceneIds": [
        "scene-orientation",
        "scene-concept",
        "scene-synthesis"
      ],
      "sourceIds": [
        "source-nist-dlmf-vectors"
      ],
      "support": "synthesis",
      "confidence": "high",
      "scope": "Real scalars and two- or three-dimensional Euclidean vectors in a declared Cartesian basis.",
      "uncertainty": "More abstract vector spaces need not carry a Euclidean magnitude or geometric direction.",
      "risk": "routine",
      "reviewStatus": "reviewed"
    },
    {
      "id": "claim-vector-components",
      "statement": "A vector can be expressed as a linear combination of coordinate unit vectors, and vector addition and scalar multiplication operate on the corresponding components.",
      "sceneIds": [
        "scene-orientation",
        "scene-concept",
        "scene-worked-example",
        "scene-misconception",
        "scene-practice",
        "scene-transfer",
        "scene-synthesis"
      ],
      "sourceIds": [
        "source-nist-dlmf-vectors"
      ],
      "support": "direct",
      "confidence": "high",
      "scope": "Two- and three-dimensional Euclidean vectors in a declared orthonormal coordinate system.",
      "uncertainty": "A component's sign and physical meaning depend on the chosen axes and orientation convention.",
      "risk": "routine",
      "reviewStatus": "reviewed"
    },
    {
      "id": "claim-vector-norm",
      "statement": "In an orthonormal Cartesian basis, a vector's magnitude is the square root of the sum of its squared components, and a nonzero vector divided by its magnitude is a unit vector.",
      "sceneIds": [
        "scene-orientation",
        "scene-concept",
        "scene-worked-example",
        "scene-misconception",
        "scene-practice",
        "scene-transfer",
        "scene-synthesis"
      ],
      "sourceIds": [
        "source-nist-dlmf-vectors"
      ],
      "support": "direct",
      "confidence": "high",
      "scope": "Euclidean norm and unit vectors in the lesson's Cartesian examples.",
      "uncertainty": "Other mathematical spaces can use different norms; the zero vector has no normalized direction.",
      "risk": "routine",
      "reviewStatus": "reviewed"
    },
    {
      "id": "claim-triangle-inequality",
      "statement": "For Euclidean vectors, the magnitude of a sum is at most the sum of the magnitudes; for two nonzero vectors equality occurs exactly when one is a positive scalar multiple of the other, and equality also holds if either vector is zero.",
      "sceneIds": [
        "scene-misconception",
        "scene-transfer",
        "scene-synthesis"
      ],
      "sourceIds": [
        "source-nist-dlmf-vectors"
      ],
      "support": "inference",
      "confidence": "high",
      "scope": "The Euclidean norm used throughout this lesson.",
      "uncertainty": "The equality condition is stated for two vectors over the real numbers.",
      "risk": "routine",
      "reviewStatus": "reviewed"
    },
    {
      "id": "claim-dot-product",
      "statement": "The dot product equals the product of vector magnitudes times the cosine of their included angle and can be used to test perpendicularity or calculate a scalar projection onto a unit direction.",
      "sceneIds": [
        "scene-concept",
        "scene-worked-example",
        "scene-practice",
        "scene-synthesis"
      ],
      "sourceIds": [
        "source-nist-dlmf-vectors"
      ],
      "support": "direct",
      "confidence": "high",
      "scope": "Real Euclidean vectors and included angles from zero through pi radians.",
      "uncertainty": "A zero vector has no direction, so an angle formula that divides by its magnitude is undefined.",
      "risk": "routine",
      "reviewStatus": "reviewed"
    },
    {
      "id": "claim-direction-components",
      "statement": "For a two-dimensional vector whose direction angle is measured counterclockwise from the positive horizontal axis, its components are magnitude times cosine and sine of that angle; quadrant-aware inverse tangent reconstructs the direction.",
      "sceneIds": [
        "scene-orientation",
        "scene-concept",
        "scene-worked-example",
        "scene-transfer",
        "scene-synthesis"
      ],
      "sourceIds": [
        "source-nist-dlmf-vectors"
      ],
      "support": "inference",
      "confidence": "high",
      "scope": "The lesson's explicitly stated two-dimensional coordinate convention.",
      "uncertainty": "Fields using bearings or different reference axes require a different component convention; a one-argument arctangent alone loses quadrant information.",
      "risk": "routine",
      "reviewStatus": "reviewed"
    }
  ]
}
