{
  "schemaVersion": 1,
  "format": "embeddedknowledge-claims-v1",
  "lessonId": "PREM-SCI-002",
  "lessonVersion": "0.3.0",
  "claims": [
    {
      "id": "claim-role-distinctions",
      "statement": "An empirical question identifies what is to be found out, a scientific hypothesis proposes an explanatory answer or relationship, and a prediction states an observable expectation derived from that hypothesis.",
      "sceneIds": [
        "scene-explain-and-expect",
        "scene-worked-comparison",
        "scene-practise-and-repair",
        "scene-transfer",
        "scene-clinical-wrap-up"
      ],
      "sourceIds": [
        "source-usgs-rigor"
      ],
      "support": "direct",
      "confidence": "high",
      "scope": "An introductory functional distinction for empirical scientific reasoning, not a claim that every discipline uses the three terms identically.",
      "uncertainty": "Researchers may use hypothesis for descriptive, explanatory, statistical, or model-based propositions; local conventions should be made explicit.",
      "risk": "routine",
      "reviewStatus": "reviewed"
    },
    {
      "id": "claim-conditional-prediction",
      "statement": "A prediction should follow from a stated hypothesis together with relevant conditions and should name an observation that can be compared with evidence.",
      "sceneIds": [
        "scene-explain-and-expect",
        "scene-worked-comparison",
        "scene-practise-and-repair",
        "scene-transfer",
        "scene-clinical-wrap-up"
      ],
      "sourceIds": [
        "source-usgs-rigor"
      ],
      "support": "synthesis",
      "confidence": "high",
      "scope": "Introductory hypothesis-to-prediction reasoning; probabilistic predictions, formal statistical hypotheses, and model-specific derivations require additional methods.",
      "uncertainty": "The precision and form of a prediction depend on the underlying model and the quality of available measurements.",
      "risk": "routine",
      "reviewStatus": "reviewed"
    },
    {
      "id": "claim-discriminating-comparison",
      "statement": "When competing hypotheses predict different observations under the same relevant conditions, the observed result can discriminate among those hypotheses more effectively than a result they all predict.",
      "sceneIds": [
        "scene-explain-and-expect",
        "scene-worked-comparison",
        "scene-practise-and-repair",
        "scene-transfer",
        "scene-clinical-wrap-up"
      ],
      "sourceIds": [
        "source-usgs-rigor",
        "source-epa-causal-assessment"
      ],
      "support": "synthesis",
      "confidence": "high",
      "scope": "Logical comparison among stated candidate hypotheses; study design, measurement quality, effect size, uncertainty, and completeness of alternatives must be evaluated separately.",
      "uncertainty": "A practically observed record may be ambiguous or noisy even when idealized predictions differ.",
      "risk": "routine",
      "reviewStatus": "reviewed"
    },
    {
      "id": "claim-before-inspection",
      "statement": "Specifying the expected observation before inspecting the relevant result limits opportunities to alter the prediction after seeing the evidence.",
      "sceneIds": [
        "scene-explain-and-expect",
        "scene-worked-comparison",
        "scene-practise-and-repair",
        "scene-transfer"
      ],
      "sourceIds": [
        "source-epa-causal-assessment"
      ],
      "support": "direct",
      "confidence": "high",
      "scope": "A transparency safeguard for the lesson's reasoning exercises; it does not imply that all valuable evidence must be newly generated or prospective.",
      "uncertainty": "The methodological weight of novel prediction compared with previously existing evidence is debated and varies with study purpose and design.",
      "risk": "routine",
      "reviewStatus": "reviewed"
    },
    {
      "id": "claim-evidence-boundary",
      "statement": "Agreement between a result and a prediction can support a hypothesis relative to stated alternatives, but one matching result alone does not prove a causal explanation or eliminate untested alternatives.",
      "sceneIds": [
        "scene-worked-comparison",
        "scene-practise-and-repair",
        "scene-transfer",
        "scene-clinical-wrap-up"
      ],
      "sourceIds": [
        "source-usgs-rigor",
        "source-epa-causal-assessment"
      ],
      "support": "direct",
      "confidence": "high",
      "scope": "Introductory interpretation of hypothesis comparisons, especially causal proposals; it is not a substitute for field-specific standards of evidence.",
      "uncertainty": "The warranted degree of support depends on design quality, measurement, prior knowledge, plausible alternatives, and the total evidence.",
      "risk": "routine",
      "reviewStatus": "reviewed"
    }
  ]
}
