{
  "schemaVersion": 1,
  "format": "embeddedknowledge-claims-v1",
  "lessonId": "PREM-QNT-001",
  "lessonVersion": "0.2.0",
  "claims": [
    {
      "id": "claim-normalized-notation",
      "statement": "Normalized scientific notation writes a nonzero number as a coefficient times an integer power of ten, with the coefficient's absolute value at least 1 and less than 10; E notation encodes the same power-of-ten relation.",
      "sceneIds": [
        "scene-concept",
        "scene-worked-example",
        "scene-misconception",
        "scene-practice",
        "scene-transfer",
        "scene-synthesis",
        "scene-clinical-wrap-up"
      ],
      "sourceIds": [
        "source-nist-sp811"
      ],
      "support": "inference",
      "confidence": "high",
      "scope": "Conventional base-10 scientific notation for nonzero real numerical values at college-introductory level.",
      "uncertainty": "NIST SP 811 Appendix B.2 directly documents positive conversion factors with coefficients from 1 up to but not including 10 and E notation. Extending that convention to a signed coefficient is an explicit elementary algebraic inference, not a direct statement from NIST. Zero is written as zero rather than assigned a unique normalized exponent; software-specific display syntax can vary.",
      "risk": "routine",
      "reviewStatus": "pending-review"
    },
    {
      "id": "claim-power-ten-arithmetic",
      "statement": "Under the standard definitions of integer powers and ordinary real-number arithmetic, multiplying powers of ten adds exponents, dividing nonzero powers subtracts exponents, and addition or subtraction requires a common power of ten before coefficients are combined.",
      "sceneIds": [
        "scene-orientation",
        "scene-concept",
        "scene-worked-example",
        "scene-misconception",
        "scene-practice",
        "scene-transfer",
        "scene-synthesis",
        "scene-clinical-wrap-up"
      ],
      "sourceIds": [
        "source-nist-sp811"
      ],
      "support": "inference",
      "confidence": "high",
      "scope": "Exact arithmetic of real numbers expressed through integer powers of ten, with nonzero divisors.",
      "uncertainty": "NIST SP 811 supports the notation but does not state these algebraic rules. The lesson derives them from repeated factors, reciprocal powers, cancellation, and the distributive law. The arithmetic is exact in the stated scope; applied values may be rounded, which this lesson excludes.",
      "risk": "routine",
      "reviewStatus": "pending-review"
    },
    {
      "id": "claim-estimation-reasonableness",
      "statement": "Approximate magnitude and comparison can be used to predict the rough scale of a numerical result and evaluate whether an exact or machine-produced result is reasonable.",
      "sceneIds": [
        "scene-orientation",
        "scene-concept",
        "scene-worked-example",
        "scene-practice",
        "scene-transfer",
        "scene-synthesis",
        "scene-clinical-wrap-up"
      ],
      "sourceIds": [
        "source-nist-everyday-estimation"
      ],
      "support": "direct",
      "confidence": "high",
      "scope": "Routine STEM arithmetic where a rough magnitude or comparison is meaningful before or after exact calculation.",
      "uncertainty": "A plausible estimate cannot prove that an exact result is correct, and estimation tolerances depend on the decision context.",
      "risk": "routine",
      "reviewStatus": "pending-review"
    },
    {
      "id": "claim-independent-challenge",
      "statement": "For exact arithmetic, bounds can test a result's scale, and a proposed quotient $q=x/y$ with $y\\neq0$ must satisfy the inverse relation $qy=x$; failures of these necessary conditions expose an inconsistent result.",
      "sceneIds": [
        "scene-worked-example",
        "scene-practice",
        "scene-transfer",
        "scene-synthesis",
        "scene-clinical-wrap-up"
      ],
      "sourceIds": [
        "source-nist-everyday-estimation",
        "source-nist-sp811"
      ],
      "support": "inference",
      "confidence": "high",
      "scope": "The exact arithmetic examples and nonzero inverse operations used in this lesson.",
      "uncertainty": "NIST's estimation page supports reasonableness checking, and SP 811 supports the notation; neither source directly states the inverse relation. The lesson derives $qy=x$ from the definition of a quotient. A check can share assumptions or errors with the original calculation, and passing one does not establish measurement validity or factual truth.",
      "risk": "routine",
      "reviewStatus": "pending-review"
    }
  ]
}
