{
  "schemaVersion": 1,
  "format": "embeddedknowledge-claims-v1",
  "lessonId": "PREM-LPP-006",
  "lessonVersion": "0.1.0",
  "claims": [
    {
      "id": "claim-key-concepts-first",
      "statement": "PubMed's basic search guidance begins by identifying the key concepts in an information need and entering terms for those concepts.",
      "sceneIds": ["scene-concept-blocks", "scene-worked-example", "scene-retrieval", "scene-practice", "scene-transfer", "scene-synthesis"],
      "sourceIds": ["source-pubmed-user-guide"],
      "support": "direct",
      "confidence": "high",
      "scope": "Basic topic searching in the PubMed interface as documented in the May 7, 2026 PubMed User Guide.",
      "uncertainty": "The guide does not prescribe one universal number of concepts; the lesson's two-to-four-block range is an explicitly labelled drafting heuristic.",
      "risk": "routine",
      "reviewStatus": "pending-review"
    },
    {
      "id": "claim-source-function-match",
      "statement": "A bibliographic database, a full-text reference collection, a systematic review, a primary research report, and a guideline perform different information functions, so the desired answer product should guide the starting source choice.",
      "sceneIds": ["scene-source-purpose", "scene-worked-example", "scene-misconception", "scene-retrieval", "scene-practice", "scene-transfer", "scene-synthesis"],
      "sourceIds": ["source-pubmed-user-guide", "source-bookshelf-overview", "source-nlm-publication-types"],
      "support": "synthesis",
      "confidence": "medium-high",
      "scope": "A foundation-level starting heuristic for biomedical and health-science information seeking, not a quality hierarchy or exhaustive taxonomy.",
      "uncertainty": "A complex or interdisciplinary question may require several source types, databases, grey-literature routes, and an information specialist rather than one starting point.",
      "risk": "routine",
      "reviewStatus": "pending-review"
    },
    {
      "id": "claim-terms-and-vocabulary",
      "statement": "PubMed searches can use ordinary terms and can map terms to Medical Subject Headings, the vocabulary NLM uses to describe articles; inspecting variants helps represent a concept despite wording differences.",
      "sceneIds": ["scene-concept-blocks", "scene-worked-example", "scene-practice", "scene-transfer", "scene-synthesis"],
      "sourceIds": ["source-pubmed-user-guide", "source-nlm-mesh-course"],
      "support": "direct",
      "confidence": "high",
      "scope": "PubMed topic searching and introductory concept planning; this lesson does not teach comprehensive controlled-vocabulary search construction.",
      "uncertainty": "Automatic mappings, indexing status, vocabularies, and preferred terms change, and not every relevant record is fully indexed with MeSH.",
      "risk": "routine",
      "reviewStatus": "pending-review"
    },
    {
      "id": "claim-query-is-prototype",
      "statement": "PubMed may translate or add terms to a query, exposes that translation in Search Details, and returns result patterns that can be used to decide which concept block to revise.",
      "sceneIds": ["scene-concept-blocks", "scene-worked-example", "scene-retrieval", "scene-practice", "scene-transfer", "scene-synthesis"],
      "sourceIds": ["source-pubmed-user-guide"],
      "support": "direct",
      "confidence": "high",
      "scope": "Iterative prototype searching in the current PubMed interface; formal reproducibility and comprehensive search validation are deferred to PREM-02.03.",
      "uncertainty": "Result ranking and interface behavior can change, so a future review must verify the current guide and interface.",
      "risk": "routine",
      "reviewStatus": "pending-review"
    },
    {
      "id": "claim-database-not-appraisal",
      "statement": "Neither inclusion in PubMed, PubMed Central, or Bookshelf nor ranking in PubMed constitutes NLM endorsement or a judgment that an individual item is accurate or high quality.",
      "sceneIds": ["scene-source-purpose", "scene-worked-example", "scene-misconception", "scene-retrieval", "scene-practice", "scene-transfer", "scene-synthesis"],
      "sourceIds": ["source-pubmed-user-guide", "source-pubmed-disclaimer"],
      "support": "synthesis",
      "confidence": "high",
      "scope": "The NLM literature databases covered by the current PubMed disclaimer.",
      "uncertainty": null,
      "risk": "routine",
      "reviewStatus": "pending-review"
    }
  ]
}
